edge_candidate_tier,edge_status,edge_role,priority,nickname,formal_event_name,formal_name_freq_in_db,hanrei_id,事件番号,date,court,n_articles,via,owner_decision,machine_verdict,conflict,machine_verdict,conflict
T2,candidate_for_review,UNVERIFIED(評釈対象 vs 引用は owner確認要),3,東京相互銀行事件,恐喝、商法違反被告事件,6,27804999,昭和６０年（あ）７１４号,昭和63.11.21,最高二小決,3,unique,,machine_candidate,,machine_candidate,
T2,candidate_for_review,UNVERIFIED(評釈対象 vs 引用は owner確認要),3,東洋タクシー事件,労働賃金請求事件,2,27613149,昭和５１年（ワ）２０５号,昭和57.11.29,釧路地帯広支判,3,unique,,machine_candidate,,machine_candidate,
T2,candidate_for_review,UNVERIFIED(評釈対象 vs 引用は owner確認要),3,福井労基署長事件,休業補償給付不支給決定取消請求控訴事件,3,27662694,昭和５７年（行コ）３号,昭和58.9.21,名古屋高金沢支判,3,unique,,machine_candidate,,machine_candidate,
T2,candidate_for_review,UNVERIFIED(評釈対象 vs 引用は owner確認要),2,N国党スラップ訴訟,損害賠償請求事件（９５６号）、同反訴請求事件（４７１号）,1,28274065,平成３０年（ワ）９５６号／令和１年（ワ）４７１号,令和1.9.19,千葉地松戸支判,2,unique,,machine_candidate,,machine_candidate,
T2,candidate_for_review,UNVERIFIED(評釈対象 vs 引用は owner確認要),2,即位儀式参列住民訴訟,即位儀式への公務参加手当返還、損害賠償等代位請求事件,1,28091849,平成１４年（行ツ）２７９号,平成16.6.28,最高二小判,2,unique,,machine_candidate,,machine_candidate,
T2,candidate_for_review,UNVERIFIED(評釈対象 vs 引用は owner確認要),2,土呂久事件第1次訴訟,損害賠償請求控訴・同附帯控訴、仮執行原状回復・損害賠償請求、損害賠償請求控訴事件,1,27802573,昭和５９年（ネ）６０号／昭和５９年（ネ）６１号／昭和５９年（ネ）２３０号／昭和６０年（ネ）１８９号／昭和５９年（ネ）９２号等,昭和63.9.30,福岡高宮崎支判,2,unique,,machine_candidate,,machine_candidate,
T2,candidate_for_review,UNVERIFIED(評釈対象 vs 引用は owner確認要),2,福岡県志免町給水拒否訴訟,給水契約上の地位確認等請求控訴（１２６号）、同附帯控訴事件（７３８号）,1,27828783,平成４年（ネ）１２６号／平成４年（ネ）７３８号,平成7.7.19,福岡高判,2,unique,,machine_candidate,,machine_candidate,
T2,candidate_for_review,UNVERIFIED(評釈対象 vs 引用は owner確認要),2,遺産分割の審判に対する即時抗告期間と訴訟,遺産分割審判等に対する抗告却下決定に対する許可抗告事件,1,28090034,平成１５年（許）２１号,平成15.11.13,最高一小決,2,unique,,machine_candidate,,machine_candidate,
T2,candidate_for_review,UNVERIFIED(評釈対象 vs 引用は owner確認要),2,タトゥー施術業医師法違反事件,医師法違反被告事件,3,28264919,平成２９年（う）１１１７号,平成30.11.14,大阪高判,2,unique,,machine_candidate,,machine_candidate,
T2,candidate_for_review,UNVERIFIED(評釈対象 vs 引用は owner確認要),2,ペット供養課税処分取消訴訟,法人税額決定処分等取消請求事件,1,28100900,平成１６年（行ウ）４号,平成17.3.24,名古屋地判,2,unique,,machine_candidate,,machine_candidate,
T2,candidate_for_review,UNVERIFIED(評釈対象 vs 引用は owner確認要),2,マンション法に関する2事件,建物の区分所有に関する法律第６０条に基づく建物賃貸借契約解除・専有部分引渡請求事件,1,27801240,昭和６０年（ワ）１２４９号,昭和61.1.29,横浜地判,2,unique,,machine_candidate,,machine_candidate,
T2,candidate_for_review,UNVERIFIED(評釈対象 vs 引用は owner確認要),2,リソー教育事件,各損害賠償請求控訴事件、附帯控訴事件,1,28253985,平成２９年（ネ）１８８２号／平成２９年（ネ）２８８１号,平成29.9.25,東京高判,2,unique,,machine_candidate,,machine_candidate,
T2,candidate_for_review,UNVERIFIED(評釈対象 vs 引用は owner確認要),2,ローソン千葉事件,損害賠償請求事件（４２５号）、清算金等請求事件（１８７５号）,1,28071041,平成７年（ワ）４２５号／平成８年（ワ）１８７５号,平成13.7.5,千葉地判,2,unique,,machine_candidate,,machine_candidate,
T2,candidate_for_review,UNVERIFIED(評釈対象 vs 引用は owner確認要),2,会社に対する責任が株主の代表訴訟,取締役責任追及請求事件,1,27412178,昭和５１年（ワ）２１３号,昭和58.2.18,名古屋地判,2,unique,,machine_candidate,,machine_candidate,
T2,candidate_for_review,UNVERIFIED(評釈対象 vs 引用は owner確認要),2,住友生命政治献金事件,社員代表訴訟等控訴事件,1,28081673,平成１３年（ネ）２７５７号,平成14.4.11,大阪高判,2,unique,,machine_candidate,,machine_candidate,
T2,candidate_for_review,UNVERIFIED(評釈対象 vs 引用は owner確認要),2,公務災害遺族補償給付の男女格差訴訟,遺族補償年金等不支給決定処分取消請求事件,5,28214229,平成２３年（行ウ）１７８号,平成25.11.25,大阪地判,2,unique,,machine_candidate,,machine_candidate,
T2,candidate_for_review,UNVERIFIED(評釈対象 vs 引用は owner確認要),2,商法210条の適用範囲と株主の代表訴訟,取締役の責任追及控訴事件,1,27807343,昭和６１年（ネ）１６４１号,平成1.7.3,東京高判,2,unique,,machine_candidate,,machine_candidate,
T2,candidate_for_review,UNVERIFIED(評釈対象 vs 引用は owner確認要),2,地目変更登記申請を却下する決定と抗告訴訟,土地地目変更登記申請却下決定処分取消請求事件,2,28071157,平成１３年（行ウ）３６号,平成13.10.19,名古屋地判,2,unique,,machine_candidate,,machine_candidate,
T2,candidate_for_review,UNVERIFIED(評釈対象 vs 引用は owner確認要),2,大津漁業協同組合事件,労働契約上の地位確認請求事件,7,28321896,令和４年（ワ）８９号,令和6.4.26,水戸地判,2,unique,,machine_candidate,,machine_candidate,
T2,candidate_for_review,UNVERIFIED(評釈対象 vs 引用は owner確認要),2,大阪市チェック・オフ廃止条例事件,チェック・オフ廃止条例処分取消請求事件,1,28180201,平成２０年（行ウ）１７６号,平成23.8.24,大阪地判,2,unique,,machine_candidate,,machine_candidate,
T2,candidate_for_review,UNVERIFIED(評釈対象 vs 引用は owner確認要),2,学校法人明治学園ほか事件,労働契約上の地位確認請求事件,7,28313190,令和４年（ワ）２２号／令和５年（ワ）４３５号,令和5.9.19,福岡地小倉支判,2,unique,,machine_candidate,,machine_candidate,
T2,candidate_for_review,UNVERIFIED(評釈対象 vs 引用は owner確認要),2,学校法人西南学院事件,労働契約上の地位確認請求事件,7,28321017,令和４年（ワ）３７５２号,令和6.1.19,福岡地判,2,unique,,machine_candidate,,machine_candidate,
T2,candidate_for_review,UNVERIFIED(評釈対象 vs 引用は owner確認要),2,川辺川ダム利水訴訟,国営川辺川土地改良事業変更計画に対する異議申立て棄却決定取消請求事件,1,28070387,平成８年（行ウ）９号,平成12.9.8,熊本地判,2,unique,,machine_candidate,,machine_candidate,
T2,candidate_for_review,UNVERIFIED(評釈対象 vs 引用は owner確認要),2,帯広電報電話局控訴事件,懲戒処分無効確認請求控訴事件,5,27670962,昭和５７年（ネ）１０７号,昭和58.8.25,札幌高判,2,unique,,machine_candidate,,machine_candidate,
T2,candidate_for_review,UNVERIFIED(評釈対象 vs 引用は owner確認要),2,弁護士法人甲野弁護士事務所事件,債務不存在確認等請求事件（本訴）（４８１号）、賃金等請求反訴事件（反訴）（７３６号）,1,28291747,平成２８年（ワ）４８１号／平成２８年（ワ）７３６号,令和3.4.27,横浜地川崎支判,2,unique,,machine_candidate,,machine_candidate,
T2,candidate_for_review,UNVERIFIED(評釈対象 vs 引用は owner確認要),2,慶応病院看護婦不採用事件,採用義務履行請求事件,2,28271350,昭和５１年（オ）５３６号,昭和51.12.24,最高三小判,2,unique,,machine_candidate,,machine_candidate,
T2,candidate_for_review,UNVERIFIED(評釈対象 vs 引用は owner確認要),2,日本ステンレス・日ス梱包事件,出向及び配転命令無効確認等請求、転勤命令無効確認等請求事件,1,27802820,昭和５４年（ワ）２７号／昭和５８年（ワ）３５号,昭和61.10.31,新潟地高田支判,2,unique,,machine_candidate,,machine_candidate,
T2,candidate_for_review,UNVERIFIED(評釈対象 vs 引用は owner確認要),2,日本トムソン派遣切り事件,開門等請求事件,2,28170512,平成２１年（ワ）５５５号,平成23.2.23,神戸地姫路支判,2,unique,,machine_candidate,,machine_candidate,
T2,candidate_for_review,UNVERIFIED(評釈対象 vs 引用は owner確認要),2,日本織物加工株式のインサイダー取引事件,暴行被告事件,9,28045224,平成９年（う）１５０３号,平成10.9.21,東京高判,2,unique,,machine_candidate,,machine_candidate,
T2,candidate_for_review,UNVERIFIED(評釈対象 vs 引用は owner確認要),2,日本電信電話事件,譴責処分無効確認等請求事件,5,28050771,平成８年（オ）１０２６号,平成12.3.31,最高二小判,2,unique,,machine_candidate,,machine_candidate,
T2,candidate_for_review,UNVERIFIED(評釈対象 vs 引用は owner確認要),2,日野自動車工業事件,雇傭関係確認請求上告事件,1,27613306,昭和５６年（オ）１００７号,昭和59.10.18,最高一小判,2,unique,,machine_candidate,,machine_candidate,
T2,candidate_for_review,UNVERIFIED(評釈対象 vs 引用は owner確認要),2,東宝・スバル事件,公正取引委員会審決取消請求事件,1,27486725,昭和２５年（行ナ）２１号,昭和26.9.19,東京高判,2,unique,,machine_candidate,,machine_candidate,
T2,candidate_for_review,UNVERIFIED(評釈対象 vs 引用は owner確認要),2,東栄衣料・県南繊維協同組合事件,賃金等請求事件（１６０号）、損害賠償等請求事件（１号）,1,28181779,平成２１年（ワ）１６０号／平成２２年（ワ）１号,平成24.2.14,福島地白河支判,2,unique,,machine_candidate,,machine_candidate,
T2,candidate_for_review,UNVERIFIED(評釈対象 vs 引用は owner確認要),2,沖縄密約情報公開訴訟,文書不開示決定処分取消等請求事件,2,28223051,平成２４年（行ヒ）３３号,平成26.7.14,最高二小判,2,unique,,machine_candidate,,machine_candidate,
T2,candidate_for_review,UNVERIFIED(評釈対象 vs 引用は owner確認要),2,犯行当時18歳の殺人事件,出版一時差止・損害賠償（甲事件）、損害賠償（乙事件）請求控訴事件,1,28212264,平成２４年（ネ）３５４号,平成25.5.30,広島高判,2,unique,,machine_candidate,,machine_candidate,
T2,candidate_for_review,UNVERIFIED(評釈対象 vs 引用は owner確認要),2,社団法人K事件,,0,28110431,平成１６年（ワ）７５８号,平成17.9.28,神戸地判,2,unique,,machine_candidate,,machine_candidate,
T2,candidate_for_review,UNVERIFIED(評釈対象 vs 引用は owner確認要),2,福岡工業大学事件,家屋明渡等請求本訴、土地所有権確認等請求反訴上告事件,1,27453061,昭和５９年（オ）３２０号,昭和60.1.31,最高一小判,2,unique,,machine_candidate,,machine_candidate,
T2,candidate_for_review,UNVERIFIED(評釈対象 vs 引用は owner確認要),2,空間除菌広告に対する措置命令の仮の差止め事件,不当利得返還等請求控訴、同附帯控訴事件,5,28312587,令和２年（ネ）４３３１号／令和３年（ネ）４６３０号,令和4.4.13,東京高決,2,unique,,machine_candidate,,machine_candidate,
T2,candidate_for_review,UNVERIFIED(評釈対象 vs 引用は owner確認要),2,群馬の森追悼碑訴訟,群馬の森追悼碑設置期間更新不許可処分取消等請求事件,1,28260946,平成２６年（行ウ）１６号,平成30.2.14,前橋地判,2,unique,,machine_candidate,,machine_candidate,
T2,candidate_for_review,UNVERIFIED(評釈対象 vs 引用は owner確認要),2,谷川電機製作所労組ほか事件,損害賠償等、動産引渡請求控訴事件,1,28292734,令和２年（ネ）２６９７号,令和3.4.7,東京高判,2,unique,,machine_candidate,,machine_candidate,
T2,candidate_for_review,UNVERIFIED(評釈対象 vs 引用は owner確認要),2,近時の最高裁判決に見る民事訴訟,遺産確認、建物明渡等請求事件,3,28220689,平成２３年（受）６０３号,平成26.2.14,最高二小判,2,unique,,machine_candidate,,machine_candidate,
T2,candidate_for_review,UNVERIFIED(評釈対象 vs 引用は owner確認要),2,遊佐町水循環条例事件,無期転換逃れ地位確認等請求控訴事件,1,28301480,令和３年（行ツ）６４号／令和３年（行ツ）６５号,令和4.1.25,最高三小判,2,unique,,machine_candidate,,machine_candidate,
T2,candidate_for_review,UNVERIFIED(評釈対象 vs 引用は owner確認要),2,過失相殺が問題となった共通義務確認訴訟,共通義務確認請求事件,7,28320687,令和４年（受）１０４１号,令和6.3.12,最高三小判,2,unique,,machine_candidate,,machine_candidate,
T2,candidate_for_review,UNVERIFIED(評釈対象 vs 引用は owner確認要),2,鈴鹿さくら病院事件,,0,28224970,平成２６年（ネ）２８３号／平成２６年（ネ）５１１号,平成26.11.27,名古屋高判,2,unique,,machine_candidate,,machine_candidate,
T2,candidate_for_review,UNVERIFIED(評釈対象 vs 引用は owner確認要),2,長沼ミサイル基地訴訟,保安林指定の解除処分取消請求事件,1,27200135,昭和４４年（行ウ）２３号／昭和４４年（行ウ）２４号／昭和４４年（行ウ）１６号,昭和48.9.7,札幌地判,2,unique,,machine_candidate,,machine_candidate,
T2,candidate_for_review,UNVERIFIED(評釈対象 vs 引用は owner確認要),2,非嫡出子住民票続柄記載国家賠償事件,住民票記載処分取消、損害賠償請求控訴事件,1,27827061,平成３年（行コ）６９号,平成7.3.22,東京高判,2,unique,,machine_candidate,,machine_candidate,
T2,candidate_for_review,UNVERIFIED(評釈対象 vs 引用は owner確認要),2,首都圏建設アスベスト神奈川第2陣訴訟,首都圏建設アスベスト損害賠償神奈川訴訟（第２陣）控訴事件,1,28283670,平成２９年（ネ）５０５８号,令和2.8.28,東京高判,2,unique,,machine_candidate,,machine_candidate,
T2,candidate_for_review,UNVERIFIED(評釈対象 vs 引用は owner確認要),2,アニメ声優事件,各ビデオ化使用料請求控訴事件,1,28100779,平成１５年（ネ）６０５１号,平成16.8.25,東京高判,2,unique,,machine_candidate,,machine_candidate,
T2,candidate_for_review,UNVERIFIED(評釈対象 vs 引用は owner確認要),2,エッソ・スタンダード石油事件,配置転換の効力停止仮処分申請事件,1,27613074,昭和５５年（ヨ）１３２８号,昭和56.9.18,名古屋地決,2,unique,,machine_candidate,,machine_candidate,
T2,candidate_for_review,UNVERIFIED(評釈対象 vs 引用は owner確認要),2,エヌアイケイほか事件,契約無効確認等請求控訴事件,2,28312696,令和４年（ネ）１６２１号,令和5.1.19,大阪高判,2,unique,,machine_candidate,,machine_candidate,
T2,candidate_for_review,UNVERIFIED(評釈対象 vs 引用は owner確認要),2,エーディーディー事件,損害賠償請求事件（２３００号）、時間外手当等反訴請求事件（３２０４号）、損害賠償等請求事件（１４４４号）,1,28174972,平成２１年（ワ）２３００号／平成２１年（ワ）３２０４号／平成２２年（ワ）１４４４号,平成23.10.31,京都地判,2,unique,,machine_candidate,,machine_candidate,
T2,candidate_for_review,UNVERIFIED(評釈対象 vs 引用は owner確認要),2,グリーンエキスプレス事件,配当異議事件（２５７２１号）、損害賠償反訴請求事件（２６３０号）,1,28224526,平成１８年（ヨ）２９号,平成18.7.20,札幌地決,2,unique,,machine_candidate,,machine_candidate,
T2,candidate_for_review,UNVERIFIED(評釈対象 vs 引用は owner確認要),2,セントラルインターナショナル事件,未払賃金等請求控訴（３６４１号）、同附帯控訴事件（６５７号）,1,28303151,令和２年（ネ）３６４１号／令和３年（ネ）６５７号,令和4.9.22,東京高判,2,unique,,machine_candidate,,machine_candidate,
T2,candidate_for_review,UNVERIFIED(評釈対象 vs 引用は owner確認要),2,ダンシング事件,取立禁止請求本訴、立替金請求反訴各控訴事件,1,28222378,平成１４年（ネ）１７１１号,平成16.4.16,大阪高判,2,unique,,machine_candidate,,machine_candidate,
T2,candidate_for_review,UNVERIFIED(評釈対象 vs 引用は owner確認要),2,ネッスル日本労働組合事件,公印等引渡等請求事件,1,27613501,昭和５９年（ワ）１１８号,昭和62.4.28,神戸地判,2,unique,,machine_candidate,,machine_candidate,
T2,candidate_for_review,UNVERIFIED(評釈対象 vs 引用は owner確認要),2,バター飴容器事件,不正競争行為差止仮処分申請却下決定に対する抗告事件,2,27486114,昭和５５年（ラ）３４号,昭和56.1.31,札幌高決,2,unique,,machine_candidate,,machine_candidate,
T2,candidate_for_review,UNVERIFIED(評釈対象 vs 引用は owner確認要),2,フジタ工業事件,意思表示の効力停止仮処分申請事件,1,27813125,平成１年（ヨ）１１６４号,平成2.7.10,名古屋地決,2,unique,,machine_candidate,,machine_candidate,
T2,candidate_for_review,UNVERIFIED(評釈対象 vs 引用は owner確認要),2,ミトミ建材センターほか事件,,0,28231382,平成２６年（ネ）５８４号,平成26.12.24,大阪高判,2,unique,,machine_candidate,,machine_candidate,
T2,candidate_for_review,UNVERIFIED(評釈対象 vs 引用は owner確認要),2,三陸ハーネス事件,損害賠償請求（本訴）事件（５３号）、損害賠償等請求（反訴）事件（７号）,1,28110432,平成１７年（ヨ）１４４号,平成17.12.15,仙台地決,2,unique,,machine_candidate,,machine_candidate,
T2,candidate_for_review,UNVERIFIED(評釈対象 vs 引用は owner確認要),2,上告理由の記載方式に関する民事訴訟,境界確認等、同反訴請求上告事件,1,27651257,昭和５８年（ネオ）１５４号,昭和58.10.14,東京高決,2,unique,,machine_candidate,,machine_candidate,
T2,candidate_for_review,UNVERIFIED(評釈対象 vs 引用は owner確認要),2,井上運輸・井上自動車整備事件,残業手当金請求控訴事件,1,27613151,昭和５４年（ネ）１１７１号,昭和57.12.10,大阪高判,2,unique,,machine_candidate,,machine_candidate,
T2,candidate_for_review,UNVERIFIED(評釈対象 vs 引用は owner確認要),2,保育園児日照被害事件,建物撤去請求事件,4,27422840,昭和４８年（ワ）２０１５号,昭和51.9.3,名古屋地判,2,unique,,machine_candidate,,machine_candidate,
T2,candidate_for_review,UNVERIFIED(評釈対象 vs 引用は owner確認要),2,千代田化工建設事件,解雇予告無効仮処分申請事件,1,27804837,昭和６３年（ヨ）４６５号,平成1.5.30,横浜地判,2,unique,,machine_candidate,,machine_candidate,
T2,candidate_for_review,UNVERIFIED(評釈対象 vs 引用は owner確認要),2,反射光公害事件,遮光工事等請求事件,1,27800167,昭和５９年（ワ）９１０９号,昭和61.3.20,大阪地判,2,unique,,machine_candidate,,machine_candidate,
T2,candidate_for_review,UNVERIFIED(評釈対象 vs 引用は owner確認要),2,和歌山労基署長事件,労災保険不支給処分取消請求事件,9,27613407,昭和５７年（行ウ）１号,昭和61.5.14,和歌山地判,2,unique,,machine_candidate,,machine_candidate,
T2,candidate_for_review,UNVERIFIED(評釈対象 vs 引用は owner確認要),2,外国人公務員東京都管理職選考受験訴訟,管理職選考受験資格確認等請求事件,2,28010785,平成６年（行ウ）３０３号,平成8.5.16,東京地判,2,unique,,machine_candidate,,machine_candidate,
T2,candidate_for_review,UNVERIFIED(評釈対象 vs 引用は owner確認要),2,大有社事件,各賃金請求事件,3,27809881,昭和６２年（ワ）１０１４１号／平成１年（ワ）４０１４号,平成2.3.28,大阪地判,2,unique,,machine_candidate,,machine_candidate,
T2,candidate_for_review,UNVERIFIED(評釈対象 vs 引用は owner確認要),2,大阪市ヘイトスピーチ条例事件,公金支出無効確認等請求事件,1,28300282,令和３年（行ツ）５４号,令和4.2.15,最高三小判,2,unique,,machine_candidate,,machine_candidate,
T2,candidate_for_review,UNVERIFIED(評釈対象 vs 引用は owner確認要),2,孔子廟・公有地無償提供違憲訴訟,固定資産税等課税免除措置取消（住民訴訟）請求事件,2,28262012,平成２９年（行ウ）９号,平成30.4.13,那覇地判,2,unique,,machine_candidate,,machine_candidate,
T2,candidate_for_review,UNVERIFIED(評釈対象 vs 引用は owner確認要),2,学校法人原田学園事件,配転処分無効確認等請求事件,2,28251275,平成２８年（ワ）２７４号,平成29.3.28,岡山地判,2,unique,,machine_candidate,,machine_candidate,
T2,candidate_for_review,UNVERIFIED(評釈対象 vs 引用は owner確認要),2,富士重工業事件,費用返還請求本訴事件（１１８９２号）、不当利得返還等請求反訴事件（１９０７３号）,1,28030837,平成８年（ワ）１１８９２号／平成９年（ワ）１９０７３号,平成10.3.17,東京地判,2,unique,,machine_candidate,,machine_candidate,
T2,candidate_for_review,UNVERIFIED(評釈対象 vs 引用は owner確認要),2,小倉電話局事件,退職金請求上告事件,4,27000979,昭和４０年（オ）５２７号,昭和43.3.12,最高三小判,2,unique,,machine_candidate,,machine_candidate,
T2,candidate_for_review,UNVERIFIED(評釈対象 vs 引用は owner確認要),2,尹秀吉事件,退去強制令書発付処分取消請求上告事件,1,27682007,昭和４７年（行ツ）６５号,昭和51.1.26,最高二小判,2,unique,,machine_candidate,,machine_candidate,
T2,candidate_for_review,UNVERIFIED(評釈対象 vs 引用は owner確認要),2,山陽新聞社事件,地位保全仮処分命令申請控訴事件,4,27611898,昭和３９年（ネ）１０号,昭和43.5.31,広島高岡山支判,2,unique,,machine_candidate,,machine_candidate,
T2,candidate_for_review,UNVERIFIED(評釈対象 vs 引用は owner確認要),2,必要的共同訴訟,土地売買無効確認請求上告事件,1,27000052,昭和５７年（行ツ）１１号,昭和58.4.1,最高二小判,2,unique,,machine_candidate,,machine_candidate,
T2,candidate_for_review,UNVERIFIED(評釈対象 vs 引用は owner確認要),2,日本ウーマン・パワー事件,商号使用差止等請求上告事件,1,27000035,昭和５７年（オ）６５８号,昭和58.10.7,最高二小判,2,unique,,machine_candidate,,machine_candidate,
T2,candidate_for_review,UNVERIFIED(評釈対象 vs 引用は owner確認要),2,日田サテライト事件,行政処分無効確認、同取消請求事件,1,28080966,平成１３年（行ウ）１０号,平成15.1.28,大分地判,2,unique,,machine_candidate,,machine_candidate,
T2,candidate_for_review,UNVERIFIED(評釈対象 vs 引用は owner確認要),2,月刊ペン事件,名誉毀損被告事件,7,27761143,昭和５５年（あ）２７３号,昭和56.4.16,最高一小判,2,unique,,machine_candidate,,machine_candidate,
T2,candidate_for_review,UNVERIFIED(評釈対象 vs 引用は owner確認要),2,榎本訴訟,ウラン残土撤去土地明渡等請求事件,1,28092744,平成１２年（ワ）１４９号,平成16.9.7,鳥取地判,2,unique,,machine_candidate,,machine_candidate,
T2,candidate_for_review,UNVERIFIED(評釈対象 vs 引用は owner確認要),2,水俣病関西訴訟,損害賠償請求控訴事件（１９５０号、１９６９号）、仮執行の原状回復等請求事件（４２０３号）,1,28061342,平成６年（ネ）１９５０号／平成６年（ネ）１９６９号／平成１１年（ネ）４２０３号,平成13.4.27,大阪高判,2,unique,,machine_candidate,,machine_candidate,
T2,candidate_for_review,UNVERIFIED(評釈対象 vs 引用は owner確認要),2,河口湖チーズケーキガーデン事件,懲戒解雇無効確認等請求事件,7,28333917,平成２６年（ワ）２６４号,平成29.3.14,甲府地判,2,unique,,machine_candidate,,machine_candidate,
T2,candidate_for_review,UNVERIFIED(評釈対象 vs 引用は owner確認要),2,海外漁業協力財団事件,懲戒処分無効確認等請求控訴事件（３２０６号）、同附帯控訴事件（３８６２号）,1,28100539,平成１６年（ネ）３２０６号／平成１６年（ネ）３８６２号,平成16.10.14,東京高判,2,unique,,machine_candidate,,machine_candidate,
T2,candidate_for_review,UNVERIFIED(評釈対象 vs 引用は owner確認要),2,琵琶湖総合開発計画差止訴訟,工事差止等請求事件,1,27804281,昭和５１年（ワ）３１号,平成1.3.8,大津地判,2,unique,,machine_candidate,,machine_candidate,
