edge_candidate_tier,edge_status,edge_role,priority,nickname,formal_event_name,formal_name_freq_in_db,hanrei_id,事件番号,date,court,n_articles,via,owner_decision,machine_verdict,conflict,machine_verdict,conflict
T3,needs_review,UNVERIFIED(評釈対象 vs 引用は owner確認要),16,福島原発事故賠償訴訟,損害賠償請求事件,36439,28251254,平成２５年（ワ）４７８号／平成２６年（ワ）１１１号／平成２６年（ワ）４６６号,平成29.3.17,前橋地判,16,unique,,CONFLICT_needs_human,yes,CONFLICT_needs_human,yes
T3,needs_review,UNVERIFIED(評釈対象 vs 引用は owner確認要),15,日産自動車事件,不当労働行為救済命令取消請求上告事件,29,27100008,昭和５３年（行ツ）４０号,昭和60.4.23,最高三小判,15,name,,CONFLICT_needs_human,yes,CONFLICT_needs_human,yes
T1,candidate_for_review,UNVERIFIED(評釈対象 vs 引用は owner確認要),13,武富士事件,贈与税決定処分取消等請求事件,1,28170244,平成２０年（行ヒ）１３９号,平成23.2.18,最高二小判,13,name,,CONFLICT_needs_human,yes,CONFLICT_needs_human,yes
T2,candidate_for_review,UNVERIFIED(評釈対象 vs 引用は owner確認要),11,津田電気計器事件,地位確認等請求上告事件,7,28182500,平成２３年（受）１１０７号,平成24.11.29,最高一小判,11,unique,,CONFLICT_needs_human,yes,CONFLICT_needs_human,yes
T3,needs_review,UNVERIFIED(評釈対象 vs 引用は owner確認要),11,名古屋自動車学校事件,地位確認等請求事件,1500,28312065,令和４年（受）１２９３号,令和5.7.20,最高一小判,11,unique,,CONFLICT_needs_human,yes,CONFLICT_needs_human,yes
T3,needs_review,UNVERIFIED(評釈対象 vs 引用は owner確認要),11,東リ事件,地位確認等請求控訴事件,293,28293693,令和２年（ネ）９７３号,令和3.11.4,大阪高判,11,unique,,CONFLICT_needs_human,yes,CONFLICT_needs_human,yes
T2,candidate_for_review,UNVERIFIED(評釈対象 vs 引用は owner確認要),10,大隈鐵工所事件,地位確認等請求上告、同附帯上告事件,1,27805120,昭和５７年（オ）３２７号,昭和62.9.18,最高三小判,10,unique,,CONFLICT_needs_human,yes,CONFLICT_needs_human,yes
T3,needs_review,UNVERIFIED(評釈対象 vs 引用は owner確認要),10,丸子警報器事件,損害賠償請求事件,36439,28010222,平成５年（ワ）１０９号,平成8.3.15,長野地上田支判,10,unique,,CONFLICT_needs_human,yes,CONFLICT_needs_human,yes
T2,candidate_for_review,UNVERIFIED(評釈対象 vs 引用は owner確認要),9,ノイズ研究所事件,賃金支払及び地位確認請求控訴事件（２０２９号）、同附帯控訴事件（６０９号）,1,28111389,平成１６年（ネ）２０２９号／平成１７年（ネ）６０９号,平成18.6.22,東京高判,9,unique,,CONFLICT_needs_human,yes,CONFLICT_needs_human,yes
T3,needs_review,UNVERIFIED(評釈対象 vs 引用は owner確認要),9,巴機械サービス事件,未払賃金等請求事件,251,28292400,平成３０年（ワ）７１５号,令和3.3.23,横浜地判,9,unique,,CONFLICT_needs_human,yes,CONFLICT_needs_human,yes
T3,needs_review,UNVERIFIED(評釈対象 vs 引用は owner確認要),9,名古屋自動車学校事件,地位確認等請求事件,1500,28283888,平成２８年（ワ）４１６５号,令和2.10.28,名古屋地判,9,unique,,CONFLICT_needs_human,yes,CONFLICT_needs_human,yes
T1,candidate_for_review,UNVERIFIED(評釈対象 vs 引用は owner確認要),8,熊谷組株主代表訴訟,各熊谷組株主代表訴訟事件,1,28081228,平成１３年（ワ）１４４号／平成１３年（ワ）２６２号,平成15.2.12,福井地判,8,name,,CONFLICT_needs_human,yes,CONFLICT_needs_human,yes
T3,needs_review,UNVERIFIED(評釈対象 vs 引用は owner確認要),8,金沢市庁舎前広場事件,損害賠償請求事件,36439,28310494,令和３年（オ）１６１７号,令和5.2.21,最高三小判,8,name,,CONFLICT_needs_human,yes,CONFLICT_needs_human,yes
T1,candidate_for_review,UNVERIFIED(評釈対象 vs 引用は owner確認要),7,Winny事件,著作権法違反幇助被告事件,2,28185001,平成２１年（あ）１９００号,平成23.12.19,最高三小決,7,name,,CONFLICT_needs_human,yes,CONFLICT_needs_human,yes
T3,needs_review,UNVERIFIED(評釈対象 vs 引用は owner確認要),7,三菱重工長崎造船所事件,賃金支払請求控訴事件,14,27828222,昭和６３年（ネ）１６号,平成7.3.15,福岡高判,7,unique,,CONFLICT_needs_human,yes,CONFLICT_needs_human,yes
T3,needs_review,UNVERIFIED(評釈対象 vs 引用は owner確認要),7,日産自動車事件,不当労働行為救済命令取消請求事件,361,27805084,昭和５７年（行ツ）５０号,昭和62.5.8,最高二小判,7,unique,,CONFLICT_needs_human,yes,CONFLICT_needs_human,yes
T1,candidate_for_review,UNVERIFIED(評釈対象 vs 引用は owner確認要),6,熊谷組株主代表訴訟,熊谷組株主代表訴訟控訴事件,1,28110282,平成１５年（ネ）６３号,平成18.1.11,名古屋高金沢支判,6,name,,CONFLICT_needs_human,yes,CONFLICT_needs_human,yes
T3,needs_review,UNVERIFIED(評釈対象 vs 引用は owner確認要),6,紅屋商事事件,不当労働行為救済命令取消請求事件,361,27613384,昭和５５年（行ツ）４０号,昭和61.1.24,最高二小判,6,unique,,CONFLICT_needs_human,yes,CONFLICT_needs_human,yes
T3,needs_review,UNVERIFIED(評釈対象 vs 引用は owner確認要),5,重複訴訟,移送申立却下決定に対する抗告事件,25,28231387,平成２６年（ラ）１１６７号,平成26.12.2,大阪高決,5,unique,,CONFLICT_needs_human,yes,CONFLICT_needs_human,yes
T3,needs_review,UNVERIFIED(評釈対象 vs 引用は owner確認要),5,伊予銀行・いよぎんスタッフサービス事件,雇用関係確認等請求事件,23,28081956,平成１２年（ワ）７５７号,平成15.5.22,松山地判,5,unique,,CONFLICT_needs_human,yes,CONFLICT_needs_human,yes
T3,needs_review,UNVERIFIED(評釈対象 vs 引用は owner確認要),5,B型肝炎訴訟,損害賠償請求事件,36439,28111291,平成１６年（受）６７２号／平成１６年（受）６７３号,平成18.6.16,最高二小判,5,unique,,CONFLICT_needs_human,yes,CONFLICT_needs_human,yes
T3,needs_review,UNVERIFIED(評釈対象 vs 引用は owner確認要),5,マンナ運輸事件,地位確認等請求事件,1500,28210201,平成２１年（ワ）５１５１号,平成24.7.13,京都地判,5,unique,,CONFLICT_needs_human,yes,CONFLICT_needs_human,yes
T2,candidate_for_review,UNVERIFIED(評釈対象 vs 引用は owner確認要),4,共有物分割訴訟,不動産競売申立却下決定に対する執行抗告事件,4,27807515,平成２年（ラ）１５１号,平成2.8.17,大阪高決,4,unique,,CONFLICT_needs_human,yes,CONFLICT_needs_human,yes
T2,candidate_for_review,UNVERIFIED(評釈対象 vs 引用は owner確認要),4,固有必要的共同訴訟,賃貸借解除・建物明渡請求控訴事件,1,27804370,昭和６３年（ネ）６８号,昭和63.10.31,名古屋高金沢支判,4,unique,,CONFLICT_needs_human,yes,CONFLICT_needs_human,yes
T2,candidate_for_review,UNVERIFIED(評釈対象 vs 引用は owner確認要),4,日本通運事件,各職業安定法違反被告事件,4,28311056,令和２年（ネ）３７２６号,令和4.11.1,東京高判,4,unique,,CONFLICT_needs_human,yes,CONFLICT_needs_human,yes
T2,candidate_for_review,UNVERIFIED(評釈対象 vs 引用は owner確認要),4,離婚訴訟,離婚請求本訴、同反訴事件,1,28091746,平成１４年（受）５０５号,平成16.6.3,最高一小判,4,unique,,CONFLICT_needs_human,yes,CONFLICT_needs_human,yes
T2,candidate_for_review,UNVERIFIED(評釈対象 vs 引用は owner確認要),4,伊予銀行・いよぎんスタッフサービス事件,雇用関係確認等請求控訴事件,6,28112177,平成１５年（ネ）２９３号,平成18.5.18,高松高判,4,unique,,CONFLICT_needs_human,yes,CONFLICT_needs_human,yes
T3,needs_review,UNVERIFIED(評釈対象 vs 引用は owner確認要),4,指定確認検査機関のした建築確認処分の取消訴訟,損害賠償請求事件,36439,28283401,平成１７年（受）９７２号,平成17.6.24,最高二小決,4,unique,,CONFLICT_needs_human,yes,CONFLICT_needs_human,yes
T3,needs_review,UNVERIFIED(評釈対象 vs 引用は owner確認要),4,固有必要的共同訴訟,土地所有権確認等請求上告事件,26,27000617,昭和４２年（オ）５３５号,昭和46.10.7,最高一小判,4,unique,,CONFLICT_needs_human,yes,CONFLICT_needs_human,yes
T3,needs_review,UNVERIFIED(評釈対象 vs 引用は owner確認要),4,ダイハツ工業事件,和解金支払請求事件,14,27651248,昭和５７年（オ）１１３２号,昭和58.9.16,最高二小判,4,unique,,CONFLICT_needs_human,yes,CONFLICT_needs_human,yes
T2,candidate_for_review,UNVERIFIED(評釈対象 vs 引用は owner確認要),3,実務と学説からみた憲法訴訟,大垣警察市民監視国家賠償請求事件（７５８号）、個人情報抹消請求事件（５１号）,1,28300700,平成２８年（ワ）７５８号／平成３０年（ワ）５１号,令和4.2.21,岐阜地判,3,unique,,CONFLICT_needs_human,yes,CONFLICT_needs_human,yes
T2,candidate_for_review,UNVERIFIED(評釈対象 vs 引用は owner確認要),3,生業訴訟,遺言確認申立却下審判に対する抗告事件,1,28283525,平成２９年（ネ）３７３号／令和２年（ネ）５６号／令和２年（ネ）６２号,令和2.9.30,仙台高判,3,unique,,CONFLICT_needs_human,yes,CONFLICT_needs_human,yes
T2,candidate_for_review,UNVERIFIED(評釈対象 vs 引用は owner確認要),3,福島原発事故賠償訴訟,投稿記事削除請求控訴事件,4,28281804,平成３０年（ネ）１６４号,令和2.3.12,仙台高判,3,unique,,CONFLICT_needs_human,yes,CONFLICT_needs_human,yes
T2,candidate_for_review,UNVERIFIED(評釈対象 vs 引用は owner確認要),3,みちのく銀行事件,地位確認等請求控訴事件（２３１号）、仮執行の原状回復申立事件（５２１号）,1,28010547,平成７年（ネ）５２１号／平成５年（ネ）２３１号,平成8.4.24,仙台高判,3,unique,,CONFLICT_needs_human,yes,CONFLICT_needs_human,yes
T2,candidate_for_review,UNVERIFIED(評釈対象 vs 引用は owner確認要),3,中部日本広告社事件,退職金及び未払賃金請求控訴事件,1,27807703,平成１年（ネ）３８６号／平成１年（ネ）４３５号,平成2.8.31,名古屋高判,3,unique,,CONFLICT_needs_human,yes,CONFLICT_needs_human,yes
T2,candidate_for_review,UNVERIFIED(評釈対象 vs 引用は owner確認要),3,東洋シート事件,一時金等請求併合事件,1,27802559,昭和５５年（ワ）６７６号／昭和５９年（ワ）５０６号,昭和63.3.2,広島地判,3,unique,,CONFLICT_needs_human,yes,CONFLICT_needs_human,yes
T2,candidate_for_review,UNVERIFIED(評釈対象 vs 引用は owner確認要),3,津田電気計器事件,地位確認等請求控訴事件（３１２３号）、同附帯控訴事件（９２号）,1,28173856,平成２２年（ネ）３１２３号／平成２３年（ネ）９２号,平成23.3.25,大阪高判,3,unique,,CONFLICT_needs_human,yes,CONFLICT_needs_human,yes
T2,candidate_for_review,UNVERIFIED(評釈対象 vs 引用は owner確認要),3,阪神バス事件,義務不存在確認等請求事件,1,28222128,平成２３年（ワ）１１１１号,平成26.4.22,神戸地尼崎支判,3,unique,,CONFLICT_needs_human,yes,CONFLICT_needs_human,yes
T3,needs_review,UNVERIFIED(評釈対象 vs 引用は owner確認要),3,実務と学説からみた憲法訴訟,損害賠償請求控訴事件,5262,28300671,令和３年（ネ）２２８号,令和4.2.22,大阪高判,3,unique,,CONFLICT_needs_human,yes,CONFLICT_needs_human,yes
T3,needs_review,UNVERIFIED(評釈対象 vs 引用は owner確認要),3,日立製作所事件,補償金請求事件,34,28112208,平成１６年（受）７８１号,平成18.10.17,最高三小判,3,unique,,CONFLICT_needs_human,yes,CONFLICT_needs_human,yes
T3,needs_review,UNVERIFIED(評釈対象 vs 引用は owner確認要),3,旧優生保護法違憲訴訟,国家賠償請求事件,585,28272557,平成３０年（ワ）７６号／平成３０年（ワ）５８１号,令和1.5.28,仙台地判,3,unique,,CONFLICT_needs_human,yes,CONFLICT_needs_human,yes
T3,needs_review,UNVERIFIED(評釈対象 vs 引用は owner確認要),3,三菱重工長崎造船所事件,賃金請求事件,299,27804844,昭和４８年（ワ）２８７号,平成1.2.10,長崎地判,3,unique,,CONFLICT_needs_human,yes,CONFLICT_needs_human,yes
T3,needs_review,UNVERIFIED(評釈対象 vs 引用は owner確認要),3,東リ事件,地位確認等請求事件,1500,28281457,平成２９年（ワ）２０３０号,令和2.3.13,神戸地判,3,unique,,CONFLICT_needs_human,yes,CONFLICT_needs_human,yes
T3,needs_review,UNVERIFIED(評釈対象 vs 引用は owner確認要),3,租税訴訟,文書提出命令申立却下決定に対する即時抗告申立事件,16,22004002,平成１年（行ス）２号,平成2.1.24,名古屋高金沢支決,3,unique,,CONFLICT_needs_human,yes,CONFLICT_needs_human,yes
T2,candidate_for_review,UNVERIFIED(評釈対象 vs 引用は owner確認要),2,四天王寺国際仏教大学事件,意思表示の効力停止等仮処分申請抗告事件,1,27808408,昭和６３年（ラ）５０２号,平成1.2.8,大阪高決,2,unique,,CONFLICT_needs_human,yes,CONFLICT_needs_human,yes
T2,candidate_for_review,UNVERIFIED(評釈対象 vs 引用は owner確認要),2,渉外家事事件,推定相続人廃除審判に対する即時抗告事件,4,28174764,平成２３年（ラ）４６０号,平成23.5.9,東京高決,2,unique,,CONFLICT_needs_human,yes,CONFLICT_needs_human,yes
T2,candidate_for_review,UNVERIFIED(評釈対象 vs 引用は owner確認要),2,筑豊じん肺訴訟,損害賠償請求控訴（６４３号、９３６号）、民事訴訟法２６０条２項による仮執行の原状回復及び損害賠償請求事件（５１３号）,1,28061661,平成７年（ネ）６４３号／平成７年（ネ）９３６号／平成８年（ネ）５１３号,平成13.7.19,福岡高判,2,unique,,CONFLICT_needs_human,yes,CONFLICT_needs_human,yes
T2,candidate_for_review,UNVERIFIED(評釈対象 vs 引用は owner確認要),2,マンナ運輸事件,従業員地位確認請求事件,7,28092353,平成１４年（ワ）２２２４号,平成16.2.27,神戸地判,2,unique,,CONFLICT_needs_human,yes,CONFLICT_needs_human,yes
T2,candidate_for_review,UNVERIFIED(評釈対象 vs 引用は owner確認要),2,三菱重工長崎造船所事件,年次有給休暇保有日数確認並びに未払賃金請求控訴事件,1,27826066,平成４年（ネ）３０６号,平成6.3.24,福岡高判,2,unique,,CONFLICT_needs_human,yes,CONFLICT_needs_human,yes
T2,candidate_for_review,UNVERIFIED(評釈対象 vs 引用は owner確認要),2,不二越訴訟,強制連行労働者等に対する未払賃金等請求事件,1,28011255,平成４年（ワ）２６３号,平成8.7.24,富山地判,2,unique,,CONFLICT_needs_human,yes,CONFLICT_needs_human,yes
T2,candidate_for_review,UNVERIFIED(評釈対象 vs 引用は owner確認要),2,不動産競売事件,嫌煙権侵害排除措置等請求事件（２９１８号）、損害賠償等請求事件（３１４４号）、損害賠償請求事件（７０９号）,1,28090150,平成１４年（ワ）７１８号,平成15.7.31,金沢地判,2,unique,,CONFLICT_needs_human,yes,CONFLICT_needs_human,yes
T2,candidate_for_review,UNVERIFIED(評釈対象 vs 引用は owner確認要),2,債権者代位訴訟,第三者の為にする契約に基づく振込金請求上告事件,1,27000204,昭和５１年（オ）４９号,昭和54.3.16,最高二小判,2,unique,,CONFLICT_needs_human,yes,CONFLICT_needs_human,yes
T2,candidate_for_review,UNVERIFIED(評釈対象 vs 引用は owner確認要),2,固有必要的共同訴訟,境界確認請求上告事件,4,27000594,昭和４４年（オ）２７９号,昭和46.12.9,最高一小判,2,unique,,CONFLICT_needs_human,yes,CONFLICT_needs_human,yes
T2,candidate_for_review,UNVERIFIED(評釈対象 vs 引用は owner確認要),2,日本トラック事件,災害補償金請求事件,8,27813988,昭和５５年（ワ）５５４号,昭和60.1.18,名古屋地判,2,unique,,CONFLICT_needs_human,yes,CONFLICT_needs_human,yes
T2,candidate_for_review,UNVERIFIED(評釈対象 vs 引用は owner確認要),2,日産自動車村山工場事件,労働契約上の地位確認請求上告事件,1,27808460,昭和６３年（オ）５１３号,平成1.12.7,最高一小判,2,unique,,CONFLICT_needs_human,yes,CONFLICT_needs_human,yes
T2,candidate_for_review,UNVERIFIED(評釈対象 vs 引用は owner確認要),2,東宝・新東宝事件,株主権仮処分異議控訴事件,1,27410141,昭和２８年（ネ）６７４号,昭和28.12.9,東京高判,2,unique,,CONFLICT_needs_human,yes,CONFLICT_needs_human,yes
T2,candidate_for_review,UNVERIFIED(評釈対象 vs 引用は owner確認要),2,熊本ねずみ講事件,贈与税、所得税課税処分取消請求控訴事件,1,22004062,昭和５９年（行コ）４号,平成2.7.18,福岡高判,2,unique,,CONFLICT_needs_human,yes,CONFLICT_needs_human,yes
T3,needs_review,UNVERIFIED(評釈対象 vs 引用は owner確認要),2,三菱重工業長崎造船所事件,労働契約関係存在確認等請求事件,11,27613356,昭和５０年（ワ）１００号,昭和60.6.26,長崎地判,2,unique,,CONFLICT_needs_human,yes,CONFLICT_needs_human,yes
T3,needs_review,UNVERIFIED(評釈対象 vs 引用は owner確認要),2,同性婚訴訟,国家賠償請求事件,585,28311970,平成３１年（ワ）５９７号,令和5.5.30,名古屋地判,2,unique,,CONFLICT_needs_human,yes,CONFLICT_needs_human,yes
T3,needs_review,UNVERIFIED(評釈対象 vs 引用は owner確認要),2,金沢市庁舎前広場事件,損害賠償請求事件,36439,28283383,平成２９年（ワ）４６９号,令和2.9.18,金沢地判,2,unique,,CONFLICT_needs_human,yes,CONFLICT_needs_human,yes
T3,needs_review,UNVERIFIED(評釈対象 vs 引用は owner確認要),2,ノイズ研究所事件,遺言無効確認請求事件,260,28092446,平成１４年（ワ）２７号,平成16.2.26,横浜地川崎支判,2,unique,,CONFLICT_needs_human,yes,CONFLICT_needs_human,yes
T3,needs_review,UNVERIFIED(評釈対象 vs 引用は owner確認要),2,中倉陸運事件,損害賠償請求控訴事件,5262,28341671,令和５年（ネ）１８６７号,令和6.1.19,大阪高判,2,unique,,CONFLICT_needs_human,yes,CONFLICT_needs_human,yes
T3,needs_review,UNVERIFIED(評釈対象 vs 引用は owner確認要),2,丸子警報器事件,地位保全仮処分申請事件,249,28011055,平成８年（ヨ）１３号,平成8.6.6,長野地上田支決,2,unique,,CONFLICT_needs_human,yes,CONFLICT_needs_human,yes
T3,needs_review,UNVERIFIED(評釈対象 vs 引用は owner確認要),2,八ッ橋事件,損害賠償請求事件,36439,28282539,平成３０年（ワ）１６３１号,令和2.6.10,京都地判,2,unique,,CONFLICT_needs_human,yes,CONFLICT_needs_human,yes
T3,needs_review,UNVERIFIED(評釈対象 vs 引用は owner確認要),2,名古屋自動車学校事件,損害賠償請求事件,36439,28181466,平成２１年（ワ）８０１５号,平成24.1.25,名古屋地判,2,unique,,CONFLICT_needs_human,yes,CONFLICT_needs_human,yes
T3,needs_review,UNVERIFIED(評釈対象 vs 引用は owner確認要),2,姫路赤十字病院事件,救済命令取消請求控訴事件,11,27613108,昭和５６年（行コ）１６号,昭和57.3.17,大阪高判,2,unique,,CONFLICT_needs_human,yes,CONFLICT_needs_human,yes
T3,needs_review,UNVERIFIED(評釈対象 vs 引用は owner確認要),2,日立製作所事件,株主総会決議取消請求事件,165,27802221,昭和６１年（ワ）１１１２６号,昭和62.1.13,東京地判,2,unique,,CONFLICT_needs_human,yes,CONFLICT_needs_human,yes
T3,needs_review,UNVERIFIED(評釈対象 vs 引用は owner確認要),2,朝日火災海上保険事件,退職金支払請求事件,16,27813982,昭和５８年（ワ）１２４号,平成2.6.25,神戸地伊丹支判,2,unique,,CONFLICT_needs_human,yes,CONFLICT_needs_human,yes
T3,needs_review,UNVERIFIED(評釈対象 vs 引用は owner確認要),2,朝日火災海上保険事件,地位確認等請求事件,1500,27804749,昭和５８年（ワ）４６５号,平成1.5.30,福岡地小倉支判,2,unique,,CONFLICT_needs_human,yes,CONFLICT_needs_human,yes
T3,needs_review,UNVERIFIED(評釈対象 vs 引用は owner確認要),2,社会福祉法人紫雲会事件,損害賠償請求控訴事件,5262,28322913,令和５年（ネ）１４０５号,令和5.10.11,東京高判,2,unique,,CONFLICT_needs_human,yes,CONFLICT_needs_human,yes
T3,needs_review,UNVERIFIED(評釈対象 vs 引用は owner確認要),2,長崎生コンクリート事件,不当利得金返還請求事件,205,27802618,昭和６１年（ワ）２２５号,昭和63.2.12,長崎地判,2,unique,,CONFLICT_needs_human,yes,CONFLICT_needs_human,yes
T3,needs_review,UNVERIFIED(評釈対象 vs 引用は owner確認要),2,阪神バス事件,損害賠償請求事件,36439,28214131,平成２４年（ラ）９１３号,平成25.5.23,大阪高決,2,unique,,CONFLICT_needs_human,yes,CONFLICT_needs_human,yes
T2,candidate_for_review,UNVERIFIED(評釈対象 vs 引用は owner確認要),1,国立大学法人賃下げ訴訟,未払賃金等請求事件（４３２号）、退職金請求事件（２６９号）,1,28233322,平成２４年（ワ）４３２号／平成２５年（ワ）２６９号,平成27.7.17,水戸地土浦支判,1,unique,,CONFLICT_needs_human,yes,CONFLICT_needs_human,yes
T2,candidate_for_review,UNVERIFIED(評釈対象 vs 引用は owner確認要),1,指定確認検査機関のした建築確認処分の取消訴訟,公金違法支出損害賠償請求事件,2,28110128,平成１６年（行ク）１６号,平成16.6.23,横浜地決,1,unique,,CONFLICT_needs_human,yes,CONFLICT_needs_human,yes
T2,candidate_for_review,UNVERIFIED(評釈対象 vs 引用は owner確認要),1,第1事件,ロイヤルティ等請求、損害賠償請求事件,1,28163302,平成２０年（ワ）６６１号／平成２０年（ワ）４９７３号,平成22.5.27,大阪地判,1,unique,,CONFLICT_needs_human,yes,CONFLICT_needs_human,yes
T2,candidate_for_review,UNVERIFIED(評釈対象 vs 引用は owner確認要),1,第1事件,,0,28163356,平成２２年（ラ）１４１７号,平成22.9.8,東京高決,1,unique,,CONFLICT_needs_human,yes,CONFLICT_needs_human,yes
T2,candidate_for_review,UNVERIFIED(評釈対象 vs 引用は owner確認要),1,B型肝炎訴訟,Ｂ型肝炎損害賠償請求事件,4,28291384,令和１年（受）１２８７号,令和3.4.26,最高二小判,1,unique,,CONFLICT_needs_human,yes,CONFLICT_needs_human,yes
T2,candidate_for_review,UNVERIFIED(評釈対象 vs 引用は owner確認要),1,B型肝炎訴訟,不正競争防止法に基づく損害賠償等請求控訴事件,1,28090822,平成１２年（ネ）１９６号,平成16.1.16,札幌高判,1,unique,,CONFLICT_needs_human,yes,CONFLICT_needs_human,yes
T2,candidate_for_review,UNVERIFIED(評釈対象 vs 引用は owner確認要),1,JR西日本事件,未払い賃金等請求事件,8,28301905,令和３年（ワ）２９８号,令和4.4.19,岡山地判,1,unique,,CONFLICT_needs_human,yes,CONFLICT_needs_human,yes
T2,candidate_for_review,UNVERIFIED(評釈対象 vs 引用は owner確認要),1,JR西日本事件,安全配慮義務履行等請求事件,1,28230176,平成２４年（ワ）４１８４号,平成26.12.3,大阪地判,1,unique,,CONFLICT_needs_human,yes,CONFLICT_needs_human,yes
T2,candidate_for_review,UNVERIFIED(評釈対象 vs 引用は owner確認要),1,USJ事件,消費者契約法による差止請求控訴事件,1,28330227,令和５年（ネ）１８１２号,令和6.12.19,大阪高判,1,unique,,CONFLICT_needs_human,yes,CONFLICT_needs_human,yes
T2,candidate_for_review,UNVERIFIED(評釈対象 vs 引用は owner確認要),1,USJ事件,消費者契約法による差止請求事件,1,28312725,令和１年（ワ）９１８５号,令和5.7.21,大阪地判,1,unique,,CONFLICT_needs_human,yes,CONFLICT_needs_human,yes
T2,candidate_for_review,UNVERIFIED(評釈対象 vs 引用は owner確認要),1,オリエンタルモーター事件,割増賃金等請求控訴事件,6,28220813,平成２５年（ネ）４０３３号,平成25.11.21,東京高判,1,unique,,CONFLICT_needs_human,yes,CONFLICT_needs_human,yes
T2,candidate_for_review,UNVERIFIED(評釈対象 vs 引用は owner確認要),1,三菱重工業長崎造船所事件,掲示板、電話設備、構内郵便集配業務等利用権確認並びに組合費等控除業務継続請求控訴事件,1,27613301,昭和５４年（ネ）２７４号,昭和59.9.18,福岡高判,1,unique,,CONFLICT_needs_human,yes,CONFLICT_needs_human,yes
T2,candidate_for_review,UNVERIFIED(評釈対象 vs 引用は owner確認要),1,三菱重工長崎造船所事件,,0,27613369,昭和５４年（ワ）５６９号,昭和60.9.24,長崎地判,1,unique,,CONFLICT_needs_human,yes,CONFLICT_needs_human,yes
T2,candidate_for_review,UNVERIFIED(評釈対象 vs 引用は owner確認要),1,不二越訴訟,強制連行労働者等に対する未払賃金等請求控訴事件,1,28060273,平成８年（ネ）１５８号,平成10.12.21,名古屋高金沢支判,1,unique,,CONFLICT_needs_human,yes,CONFLICT_needs_human,yes
T2,candidate_for_review,UNVERIFIED(評釈対象 vs 引用は owner確認要),1,中部日本広告社事件,退職金請求、未払賃金請求事件,1,27805185,昭和６２年（ワ）３２３３号／昭和６１年（ワ）３５２４号,平成1.6.26,名古屋地判,1,unique,,CONFLICT_needs_human,yes,CONFLICT_needs_human,yes
