source	field	title	note
shiseido	(別ファイル)	(shiseido_standard_books_master.csv 参照: 1036冊・ISBN付)	tier=newcomer/field
businesslawyers	会社法	株式会社法	江頭憲治郎/有斐閣
businesslawyers	会社法	LEGAL QUEST 会社法	伊藤靖史ほか/有斐閣
businesslawyers	会社法	会社法	田中亘/東京大学出版会
businesslawyers	会社法	会社法コンメンタール	江頭憲治郎編/商事法務
businesslawyers	会社法	新基本法コンメンタール会社法	奥島孝康ほか編/日本評論社
businesslawyers	会社法	会社法書式集	阿部・井窪・片山法律事務所/商事法務
businesslawyers	会社法	会社法実務スケジュール	新日本法規出版
businesslawyers	会社法	「会社法」法令集	中央経済社
businesslawyers	契約	契約書作成の実務と書式	阿部・井窪・片山法律事務所/有斐閣
businesslawyers	契約	ユーザを成功に導くAI開発契約	西本強/商事法務
businesslawyers	契約	AI開発のための法律知識と契約書作成のポイント	福岡真之介/清文社
businesslawyers	契約	業務委託契約書作成のポイント	淵邊善彦ほか/中央経済社
businesslawyers	契約	英文契約書の読み方	山本孝夫/日本経済新聞出版
businesslawyers	契約	英文契約書の書き方	山本孝夫/日本経済新聞出版
businesslawyers	契約	新民法対応 契約審査手続マニュアル	愛知県弁護士会/新日本法規出版
businesslawyers	契約	ビジネス契約書の読み方・書き方・直し方	長瀨佑志ほか/JMAM
businesslawyers	労働	労働法	菅野和夫/弘文堂
businesslawyers	労働	労働法	水町勇一郎/有斐閣
businesslawyers	労働	詳解労働法	水町勇一郎/東京大学出版会
businesslawyers	労働	新しい労使関係のための労働時間・休日・休暇の法律実務	安西愈/中央経済社
businesslawyers	労働	労働事件ハンドブック	第二東京弁護士会労働問題検討委員会/労働開発研究会
businesslawyers	労働	新版 新・労働法実務相談	労務行政研究所/労務行政
businesslawyers	個人情報	ニッポンの個人情報	鈴木正朝ほか/翔泳社
businesslawyers	個人情報	個人情報保護法の解説	園部逸夫ほか/ぎょうせい
businesslawyers	個人情報	個人情報保護法	岡村久道/商事法務
businesslawyers	個人情報	個人情報保護法制大全	西村あさひ法律事務所/商事法務
businesslawyers	個人情報	データ利活用とプライバシー・個人情報保護	渡邊涼介/青林書院
businesslawyers	個人情報	良いウェブサービスを支える「利用規約」の作り方	雨宮美季ほか/技術評論社
businesslawyers	個人情報	ガイドブック AI・データビジネスの契約実務	齊藤友紀ほか/商事法務
businesslawyers	個人情報	ストーリーとQ&Aで学ぶ改正個人情報保護法	関原秀行/日本加除出版
businesslawyers	一般	弁護士になった「その先」のこと	中村直人ほか/商事法務
businesslawyers	一般	希望の法務	明司雅宏/商事法務
businesslawyers	著作権	著作権法	中山信弘/有斐閣
businesslawyers	労働	労働法実務 労働者側の実践知	君和田伸仁/有斐閣
businesslawyers	企業法務	事業担当者のための逆引きビジネス法務ハンドブック	塩野誠ほか/東洋経済新報社
businesslawyers	企業法務	起業の法務	TMI総合法律事務所/商事法務
keiyakuwatch	企業法務	今日から法務パーソン	藤井豊久ほか
keiyakuwatch	企業法務	企業法務入門テキスト ありのままの法務	経営法友会
keiyakuwatch	企業法務	希望の法務	明司雅宏
keiyakuwatch	企業法務	スキルアップのための企業法務のセオリー	瀧川英雄
keiyakuwatch	企業法務	事業担当者のための逆引きビジネス法務ハンドブック	塩野誠ほか
keiyakuwatch	企業法務	条文の読み方	法制執務・法令用語研究会
keiyakuwatch	企業法務	ビジネス実務法務検定試験 公式テキスト	東京商工会議所
keiyakuwatch	契約	契約書作成の実務と書式	阿部・井窪・片山法律事務所
keiyakuwatch	契約	契約審査のベストプラクティス	みらい総合法律事務所
keiyakuwatch	契約	ザ・コントラクト	LegalOn Technologies
keiyakuwatch	契約	M&Aの契約実務	藤原総一郎ほか
keiyakuwatch	契約	株主間契約・合弁契約の実務	藤原総一郎ほか
keiyakuwatch	契約	ジョイント・ベンチャー契約の実務と理論	金丸和弘ほか
keiyakuwatch	契約	業務委託契約書作成のポイント	近藤圭介
keiyakuwatch	契約	ライセンス契約書作成のポイント	小坂準記
keiyakuwatch	契約	英文ビジネス契約書大辞典	山本孝夫
keiyakuwatch	民法	民法（全）	潮見佳男
keiyakuwatch	民法	民法講義	近江幸治
keiyakuwatch	民法	債権総論	中田裕康
keiyakuwatch	民法	契約法	中田裕康
keiyakuwatch	民法	我妻・有泉コンメンタール民法	我妻榮ほか
keiyakuwatch	民法	一問一答 民法（債権関係）改正	筒井健夫ほか
keiyakuwatch	会社法	手にとるようにわかる会社法入門	川井信之
keiyakuwatch	会社法	会社法ハンドブック	中村直人ほか
keiyakuwatch	会社法	会社法コンメンタール	江頭憲治郎ほか
keiyakuwatch	会社法	論点体系 会社法	江頭憲治郎ほか
keiyakuwatch	会社法	会社法	田中亘
keiyakuwatch	会社法	会社法	神田秀樹
keiyakuwatch	会社法	株式会社法	江頭憲治郎
keiyakuwatch	独禁	条文から学ぶ独占禁止法	土田和博ほか
keiyakuwatch	独禁	独占禁止法	金井貴嗣ほか
keiyakuwatch	独禁	独禁法講義	白石忠志
keiyakuwatch	独禁	独占禁止法の実践知	長澤哲也
keiyakuwatch	独禁	条解 独占禁止法	村上政博ほか
keiyakuwatch	下請	はじめて学ぶ下請法	鎌田明
keiyakuwatch	下請	下請法の法律相談	内田清人ほか
keiyakuwatch	個人情報	個人情報保護法の知識	岡村久道
keiyakuwatch	個人情報	個人情報保護法制大全	西村あさひ法律事務所
keiyakuwatch	個人情報	一問一答 令和2年改正個人情報保護法	佐脇紀代志
keiyakuwatch	個人情報	一問一答 令和3年改正個人情報保護法	冨安泰一郎ほか
keiyakuwatch	労働	人事の法律常識	安西愈
keiyakuwatch	労働	企業労働法実務入門 書式編	企業人事労務研究会
keiyakuwatch	労働	新版 新・労働法実務相談	労務行政研究所
keiyakuwatch	労働	労働法	菅野和夫
keiyakuwatch	労働	労働法	水町勇一郎
keiyakuwatch	労働	労働法	荒木尚志
keiyakuwatch	著作権	著作権法入門	島並良ほか
keiyakuwatch	著作権	特許法・著作権法	小泉直樹
keiyakuwatch	著作権	知的財産法	角田政芳ほか
keiyakuwatch	著作権	実務者のための著作権ハンドブック	池村聡ほか
keiyakuwatch	著作権	著作権法	中山信弘
keiyakuwatch	著作権	著作権法コンメンタール	半田正夫ほか
keiyakuwatch	著作権	条解著作権法	小泉直樹ほか
keiyakuwatch	著作権	音楽・動画クリエイターの権利とルール	高木啓成
businessandlaw	先端	攻めの法務	渡部友一郎/日本加除出版
businessandlaw	行政	行政法解釈の技法	伊藤建ほか/弘文堂
businessandlaw	企業法務	キャリアプランニングのための企業法務弁護士入門	松尾剛行/有斐閣
businessandlaw	先端	実務解説サイバーセキュリティ法	八雲法律事務所/中央経済社
businessandlaw	先端	クラウド情報管理の法律実務	松尾剛行/弘文堂
businessandlaw	個人情報	60分でわかる!改正個人情報保護法超入門	田中浩之ほか/技術評論社
bengo4times	事業承継	8士業が解説 中小企業支援者のための社長の終活	狩倉博之/学陽書房
bengo4times	刑事	取調べの可視化 その理論と実践	小坂井久/現代人文社
bengo4times	契約	新版 負けない英文契約書	熊木明/清文社
bengo4times	海外	ベトナム進出・展開・撤退の実務	弁護士法人One Asia/同文舘出版
bengo4times	税務	こうして勝ち抜いてきた税務争訟の闘い方	山本洋一郎/法律文化社
bengo4times	労働	Q&A 現代型問題管理職対策の手引	髙井・岡芹法律事務所/民事法研究会
legaljobboard	新人	若手弁護士のための 初動対応の実務	-
legaljobboard	新人	若手法律家のための法律相談入門	-
legaljobboard	新人	契約書作成の実務と書式	阿部・井窪・片山法律事務所
legaljobboard	中堅	弁護士の周辺学	-
legaljobboard	相続	三士業の実務がクロスする相続事案の解決力	-
legaljobboard	交通	交通事故事件の実務-裁判官の視点-	-
legaljobboard	独立	弁護士のための事務所開設・運営の手引き	-
legaljobboard	独立	弁護士 独立・経営の不安解消Q&A	-
legaljobboard	独立	法律事務所の経理と税務	-
legaljobboard	会社法	株主総会ハンドブック	-
legaljobboard	会社法	定款・各種規則の作成実務	-
legaljobboard	一般	法律文書作成の基本	田中豊
legaljobboard	一般	事例に学ぶシリーズ	-
legaljobboard	一般	実務の技法シリーズ	-
legaljobboard	一般	新・センスのよい法律文書の書き方	-
niben	刑事	弁護のゴールデンルール	キース・エヴァンス/現代人文社
niben	刑事	法廷弁護技術	日弁連/日本評論社
niben	民事	要件事実マニュアル	岡口基一/ぎょうせい
niben	民事	Q&A証拠説明書・陳述書の実務	岡山弁護士会/ぎょうせい
niben	民事	民法（債権関係）改正法案の概要	潮見佳男/金融財政事情研究会
niben	会社法	株式会社法	江頭憲治郎/有斐閣
niben	会社法	数字でわかる会社法	田中亘/有斐閣
niben	労働	労働関係訴訟の実務	白石哲/商事法務
niben	労働	労働法	菅野和夫/弘文堂
niben	労働	労働事件審理ノート	山口幸雄ほか/判例タイムズ社
niben	知財	知的財産法入門	茶園成樹/有斐閣
niben	知財	著作権・商標・不競法関係訴訟の実務	髙部眞規子/商事法務
niben	倒産	破産管財人の財産換価	岡伸浩ほか/商事法務
niben	倒産	事業再生におけるスポンサー選定のあり方	山本和彦ほか/商事法務
niben	行政	改訂 行政事件訴訟の一般的問題に関する実務的研究	司法研修所/法曹会
niben	行政	紛争類型別 行政救済法	吉野夏己/成文堂
niben	行政	事例に学ぶ行政訴訟入門	野村創/民事法研究会
niben	経済法	独占禁止法の法律相談	小林覚ほか/青林書院
niben	経済法	独占禁止法	白石忠志/有斐閣
niben	経済法	実務に効く公正取引審決判例精選	泉水文雄ほか/有斐閣
niben	経済法	下請の法律実務	伊東章二ほか/三協法規出版
niben	消費者	キーワード式消費者法事典	日弁連消費者問題対策委員会/民事法研究会
niben	消費者	改正特定商取引法のすべて	村千鶴子/中央経済社
niben	消費者	特定商取引法ハンドブック	齋藤雅弘ほか/日本評論社
niben	法律事務	弁護士の失敗学	高中正彦ほか/ぎょうせい
niben	法律事務	法律文書作成の基本	田中豊/日本評論社
niben	法律事務	Q&Aで分かる法律事務職員実践ガイド	第二東京弁護士会/第一法規
osaka	事務	法律事務の手引	大阪弁護士会・大阪弁護士協同組合
osaka	民事	書式と理論で民事手続	法と実務研究会/日本評論社
osaka	倒産	破産管財手続の運用と書式	大阪地裁・大阪弁護士会/新日本法規
osaka	倒産	事例解説 個人再生	大阪地裁・大阪弁護士会/新日本法規
osaka	刑事	刑事弁護ビギナーズ	現代人文社
osaka	刑事	少年事件ビギナーズ	現代人文社
osaka	倒産	テキスト・破産パラリーガル	若松敏幸ほか
osaka	事務	法律事務職員簡単実務マニュアル	パラリーガルクラブ/弘文堂
osaka	相続	わかりやすい 戸籍の見方・読み方・取り方	伊波喜一郎ほか/日本法令
osaka	成年後見	自分でできる成年後見制度の手続	大阪弁護士会
osaka	成年後見	新版成年後見人の実務	大阪弁護士会
osaka	交通	交通事故事件処理マニュアル	大阪弁護士会交通事故委員会
osaka	債務整理	任意整理マニュアル	大阪弁護士会
osaka	事務	法律事務所の経理と税務	日弁連/新日本法規出版
keisobiblio	基本	条文の読み方	法制執務用語研究会/有斐閣
keisobiblio	基本	法律文書作成の基本	田中豊/日本評論社
keisobiblio	基本	最新 公用文用字用語例集	ぎょうせい公用文研究会/ぎょうせい
keisobiblio	基本	新版 ガイドブック弁護士報酬	吉原省三ほか/商事法務
keisobiblio	基本	弁護士独立のすすめ	北周士/第一法規
keisobiblio	基本	弁護のゴールデンルール	キース・エヴァンス/現代人文社
keisobiblio	文献	リーガル・リサーチ	指宿信ほか/日本評論社
keisobiblio	文献	立証の実務	群馬弁護士会/ぎょうせい
keisobiblio	文献	デジタル証拠の法律実務Q&A	高橋郁夫ほか/日本加除出版
keisobiblio	文献	弁護士法第23条の2照会の手引	第一東京弁護士会
keisobiblio	文献	新版 証拠保全の実務	森冨義明ほか/きんざい
keisobiblio	一般民事	我妻・有泉コンメンタール民法	我妻榮ほか/日本評論社
keisobiblio	一般民事	契約の法務	喜多村勝德/勁草書房
keisobiblio	一般民事	契約書作成の実務と書式	阿部・井窪・片山法律事務所/有斐閣
keisobiblio	一般民事	契約書式実務全書	大村多聞ほか/ぎょうせい
keisobiblio	一般民事	秘密保持契約の実務	森本大介ほか/中央経済社
keisobiblio	一般民事	応用自在!内容証明作成のテクニック	みらい総合法律事務所/日本法令
keisobiblio	一般民事	和解条項に関する実証的研究	裁判所職員総合研修所/法曹会
keisobiblio	一般民事	和解・調停モデル文例集	星野雅紀/新日本法規出版
keisobiblio	一般民事	基礎からわかる供託	磯部慎吾/きんざい
keisobiblio	一般民事	個人債務整理事件処理マニュアル	茨木茂/新日本法規出版
keisobiblio	一般民事	破産申立マニュアル	東京弁護士会倒産法部会/商事法務
keisobiblio	一般民事	若手弁護士のための民事裁判実務の留意点	圓道至剛/新日本法規出版
keisobiblio	一般民事	民事尋問技術	加藤新太郎/ぎょうせい
keisobiblio	一般民事	文書提出命令の理論と実務	山本和彦ほか/民事法研究会
keisobiblio	一般民事	事例からみる訴額算定の手引	小川英明ほか/新日本法規出版
keisobiblio	一般民事	民事事実認定と立証活動	加藤新太郎/判例タイムズ
keisobiblio	一般民事	憲法の地図	大島義則/法律文化社
keisobiblio	一般民事	慰謝料算定の実務	千葉県弁護士会/ぎょうせい
keisobiblio	一般民事	民事執行の実務 不動産執行編	東京地裁民事執行センター/きんざい
keisobiblio	一般民事	民事執行の実務 債権執行編	東京地裁民事執行センター/きんざい
keisobiblio	一般民事	民事保全の実務	八木一洋ほか/きんざい
keisobiblio	一般民事	完全講義 民事裁判実務の基礎	大島眞一/民事法研究会
keisobiblio	不動産	コンメンタール借地借家法	稲本洋之助ほか/日本評論社
keisobiblio	不動産	建物賃貸借	渡辺晋/大成出版社
keisobiblio	不動産	借地借家事件処理マニュアル	清水俊順ほか/新日本法規出版
keisobiblio	不動産	私道・境界・近隣紛争の法律相談	野辺博/学陽書房
keisobiblio	不動産	コンメンタール マンション区分所有法	稲本洋之助ほか/日本評論社
keisobiblio	不動産	コンメンタール マンション標準管理規約	稲本洋之助ほか/日本評論社
keisobiblio	交通	交通損害関係訴訟	佐久間邦夫ほか/青林書院
keisobiblio	消費者	消費者行政法	大島義則ほか/勁草書房
keisobiblio	消費者	消費者相談マニュアル	東京弁護士会/商事法務
keisobiblio	消費者	逐条解説 消費者契約法	消費者庁消費者制度課/商事法務
keisobiblio	消費者	特定商取引に関する法律の解説	消費者庁/商事法務
keisobiblio	消費者	景品表示法	真渕博/商事法務
keisobiblio	消費者	逐条講義 製造物責任法	土庫澄子/勁草書房
keisobiblio	労務	労働法	菅野和夫/弘文堂
keisobiblio	労務	採用から退職までの法律知識	安西愈/中央経済社
keisobiblio	労務	労働基準法	厚生労働省労働基準局/労務行政
keisobiblio	労務	未払い残業代請求法律実務マニュアル	旬報法律事務所/学陽書房
keisobiblio	税務	租税法	金子宏/弘文堂
keisobiblio	税務	取引スキーム別契約書作成に役立つ税務知識Q&A	森・濱田松本法律事務所/中央経済社
keisobiblio	知財	著作権法コンメンタール	半田正夫ほか/勁草書房
keisobiblio	知財	新・商標法概説	小野昌延ほか/青林書院
keisobiblio	知財	新・不正競争防止法概説	小野昌延ほか/青林書院
keisobiblio	知財	特許法	中山信弘/弘文堂
keisobiblio	知財	エンタテインメント契約法	内藤篤/商事法務
keisobiblio	独禁	独占禁止法	菅久修一ほか/商事法務
keisobiblio	情報	インターネット上の名誉毀損の理論と実務	松尾剛行/勁草書房
keisobiblio	個人情報	平成27年改正個人情報保護法のしくみ	日置巴美ほか/商事法務
keisobiblio	個人情報	やさしいマイナンバー法入門	水町雅子/商事法務
keisobiblio	企業法務	株式会社法	江頭憲治郎/有斐閣
keisobiblio	企業法務	コンパクト解説会社法	商事法務
keisobiblio	M&A	法務デューデリジェンスの実務	長島・大野・常松法律事務所/中央経済社
keisobiblio	M&A	M&Aの契約実務	藤原総一郎/中央経済社
keisobiblio	国際	逐条解説 法の適用に関する通則法	小出邦夫/商事法務
keisobiblio	国際	英文ビジネス契約書大辞典	山本孝夫/日本経済新聞出版社
keisobiblio	国際	中国ビジネス法体系	藤本豪/日本評論社
keisobiblio	情報	サイト別 ネット中傷・炎上対応マニュアル	清水陽平/弘文堂
keisobiblio	家事	新版 家事事件の申立書式と手続	長山義彦ほか/新日本法規出版
keisobiblio	家事	家事事件の理論と実務	松原正明ほか/勁草書房
keisobiblio	家事	離婚・内縁解消の法律相談	山之内三紀子/青林書院
keisobiblio	家事	新版 離婚調停	秋武憲一/日本加除出版
keisobiblio	家事	判例による不貞慰謝料請求の実務	中里和伸/LABO
keisobiblio	家事	「子どもの引渡し」の法律と実務	石田文三/清文社
keisobiblio	家事	相続・遺言の法律相談	髙岡信男/学陽書房
keisobiblio	家事	証書の作成と文例 遺言編	日本公証人連合会/立花書房
keisobiblio	家事	家庭裁判所における遺産分割・遺留分の実務	片岡武ほか/日本加除出版
keisobiblio	家事	相続における戸籍の見方と登記手続	高妻新ほか/日本加除出版
keisobiblio	家事	家庭裁判所における成年後見・財産管理の実務	片岡武ほか/日本加除出版
keisobiblio	家事	任意後見契約書の解説と実務	山本修ほか/三協法規出版
keisobiblio	家事	要約離婚判例	本橋美智子/学陽書房
keisobiblio	刑事	刑事弁護ビギナーズ	現代人文社
keisobiblio	刑事	大コンメンタール刑法	青林書院
keisobiblio	刑事	注釈刑法	有斐閣
keisobiblio	刑事	大コンメンタール刑事訴訟法	青林書院
keisobiblio	刑事	条解刑法	前田雅英/弘文堂
keisobiblio	刑事	条解刑事訴訟法	松尾浩也/弘文堂
keisobiblio	刑事	令状に関する理論と実務	高麗邦彦ほか/判例タイムズ
keisobiblio	刑事	実践!刑事証人尋問技術	現代人文社
keisobiblio	刑事	実践!刑事弁護異議マニュアル	大阪弁護士会/現代人文社
keisobiblio	刑事	量刑調査報告集	第一東京弁護士会
keisobiblio	刑事	刑事弁護人のための隠語・俗語・実務用語辞典	下村忠利/現代人文社
keisobiblio	刑事	少年事件付添人マニュアル	福岡県弁護士会/日本評論社
keisobiblio	刑事	実践 犯罪被害者支援と刑事弁護	兵庫県弁護士会/民事法研究会
keisobiblio	刑事	犯罪事実記載の実務 刑法犯	末永秀夫ほか/実務法規
keisobiblio	行政	逐条解説 行政手続法	行政管理研究センター/ぎょうせい
keisobiblio	行政	改正行政不服審査法と不服申立実務	日弁連行政訴訟センター/民事法研究会
keisobiblio	行政	条解行政事件訴訟法	南博方ほか/弘文堂
keisobiblio	行政	国家賠償法コンメンタール	西埜章/勁草書房
keisobiblio	行政	住民訴訟の上手な活用法	井上元/民事法研究会
keisobiblio	行政	逐条地方自治法	松本英昭/学陽書房
keisobiblio	行政	行政関係訴訟の実務	定塚誠/商事法務
